{
  "schema_version": "1.0",
  "source": {
    "filename": "known-cuts.mp4",
    "sha256": "1058a2674aa2dd870ff31f6bcc0f14eb60587a0f5c4ffa71dcfa8d2b362264cf",
    "size_bytes": 3900,
    "duration_seconds": 3.0,
    "container_formats": [
      "3g2",
      "3gp",
      "m4a",
      "mj2",
      "mov",
      "mp4"
    ],
    "streams": [
      {
        "kind": "video",
        "codec": "h264",
        "duration_seconds": 3.0,
        "packet_count": 90
      }
    ]
  },
  "detector": {
    "name": "pyscenedetect_content",
    "threshold": 27.0,
    "version": "0.7.2",
    "ffmpeg_version": "ffmpeg version 7.1 Copyright (c) 2000-2024 the FFmpeg developers"
  },
  "shots": [
    {
      "id": "shot_0001",
      "start_frame": 0,
      "end_frame": 30,
      "start_seconds": 0.0,
      "end_seconds": 1.0,
      "keyframe": {
        "path": "frames/shot_0001.jpg",
        "frame_index": 14,
        "time_seconds": 0.466667
      },
      "visual": {
        "status": "unavailable"
      },
      "narrative": {
        "status": "unavailable"
      }
    },
    {
      "id": "shot_0002",
      "start_frame": 30,
      "end_frame": 60,
      "start_seconds": 1.0,
      "end_seconds": 2.0,
      "keyframe": {
        "path": "frames/shot_0002.jpg",
        "frame_index": 44,
        "time_seconds": 1.466667
      },
      "visual": {
        "status": "unavailable"
      },
      "narrative": {
        "status": "unavailable"
      }
    },
    {
      "id": "shot_0003",
      "start_frame": 60,
      "end_frame": 90,
      "start_seconds": 2.0,
      "end_seconds": 3.0,
      "keyframe": {
        "path": "frames/shot_0003.jpg",
        "frame_index": 74,
        "time_seconds": 2.466667
      },
      "visual": {
        "status": "unavailable"
      },
      "narrative": {
        "status": "unavailable"
      }
    }
  ],
  "audio": {
    "status": "unavailable",
    "reason": "源视频没有音轨"
  },
  "dialogue": {
    "status": "unavailable",
    "reason": "源视频没有音轨"
  },
  "report": "report.html",
  "run": "run.json"
}